<?xml version="1.0" encoding="UTF-8"?>
<tns:Payments xmlns:tns="http://training.gpte.redhat.com/payment"
              xmlns:xsi="http://www.w3.org/2001/XMLSchema-instance"
              xsi:schemaLocation="training.gpte.redhat.com/payment ../../resources/xsd/Payment.xsd">

    <tns:Currency>USD</tns:Currency>

    <tns:Payment>
        <tns:from>chad-USD</tns:from>
        <tns:to>jeff</tns:to>
        <tns:amount>1000000.0</tns:amount>
    </tns:Payment>
    <tns:Payment>
        <tns:from>rachel-USD</tns:from>
        <tns:to>chad</tns:to>
        <tns:amount>78.0</tns:amount>
    </tns:Payment>
    <tns:Payment>
        <tns:from>rachel-USD</tns:from>
        <tns:to>chad</tns:to>
        <tns:amount>13.0</tns:amount>
    </tns:Payment>
    <tns:Payment>
        <tns:from>jingjing-USD</tns:from>
        <tns:to>jeff</tns:to>
        <tns:amount>10.0</tns:amount>
    </tns:Payment>

</tns:Payments>
